{
  "id": "action_001",
  "org_id": "org_11111111-1111-1111-1111-111111111111",
  "project_id": "123e4567-e89b-12d3-a456-426614174000",
  "title": "Resolve structural steel delivery delay",
  "description": "Steel supplier has delayed delivery by 2 weeks due to manufacturing issues. Need to expedite or find alternative supplier.",
  "category": "schedule_delay",
  "severity": "high",
  "status": "open",
  "priority": 2,
  "due_at": "2025-11-05T17:00:00Z",
  "assigned_to": "usr_pm_001",
  "assigned_role": "pm",
  "impact": {
    "budget_impact": 25000,
    "schedule_impact_days": 14
  },
  "attachments": [
    {
      "id": "att_001",
      "filename": "supplier_delay_notice.pdf",
      "url": "https://storage.example.com/documents/att_001.pdf",
      "mime_type": "application/pdf",
      "size_bytes": 245678
    }
  ],
  "comments": [
    {
      "id": "comment_001",
      "user_id": "usr_super_001",
      "text": "Contacted alternative supplier, waiting for quote",
      "created_at": "2025-10-29T14:30:00Z"
    }
  ],
  "created_at": "2025-10-28T09:15:00Z",
  "updated_at": "2025-10-30T22:30:00Z",
  "created_by": "usr_super_001",
  "updated_by": "usr_pm_001"
}